{
  "version": "1.1.0",
  "lastUpdated": "2026-09-07",
  "blanketExceptions": [],
  "exceptions": [
    {
      "id": "exc-2026-08-19-001",
      "package": "Grafana k6 (`go.k6.io/k6/v2` Go module and `grafana/k6:*-with-browser` container image; `v2.1.0` is the version pinned as of this writing)",
      "packageUrl": "https://github.com/grafana/k6",
      "license": "AGPL-3.0-only",
      "project": "OpenTelemetry (OpenTelemetry Demo, https://github.com/open-telemetry/opentelemetry-demo)",
      "approvedDate": "2026-08-19",
      "issueUrl": "https://github.com/cncf/foundation/issues/1482",
      "results": "https://github.com/cncf/foundation/issues/1482",
      "status": "not-eligible",
      "scope": "k6 provides the OpenTelemetry Demo's synthetic HTTP and browser traffic generator and exports load-test metrics through OTLP. The project compiles k6 with its Apache-2.0 `xk6-otel` extension so synthetic spans, logs, metrics, and propagated trace context can be correlated with telemetry from the services being exercised. (used at: https://github.com/open-telemetry/opentelemetry-demo/blob/main/src/load-generator/xk6-otel/go.mod)"
    },
    {
      "id": "exc-2026-05-08-001",
      "package": "RemixIcon",
      "license": "Remix Icon License v1.0",
      "project": "Backstage",
      "approvedDate": "2026-05-08",
      "status": "denied",
      "scope": "Not Applicable (Denied)",
      "results": "https://github.com/cncf/foundation/issues/1380",
      "comment": "Denied: Remix Icon License v1.0 is not an open source license and is not eligible for exception approval."
    },
    {
      "id": "exc-2026-05-06-001",
      "package": "axe-core",
      "license": "MPL-2.0",
      "project": "All CNCF Projects",
      "approvedDate": "2026-04-09",
      "status": "approved",
      "scope": "Approved only for unmodified upstream axe-core used as a separated component; intermingled use is not approved.",
      "results": "https://github.com/cncf/foundation/issues/1323",
      "comment": "Blanket exception approved by GB email vote dated 2026-04-09."
    },
    {
      "id": "exc-2026-04-23-001",
      "package": "picolibc",
      "license": "BSD-3-Clause, BSD-2-Clause, MIT, BSL-1.0, NCSA, Public Domain / CC0-1.0",
      "project": "Hyperlight",
      "approvedDate": "2026-04-22",
      "status": "approved",
      "scope": "Approved only for picolibc files under BSD-3-Clause, BSD-2-Clause, MIT, BSL-1.0, NCSA, or Public Domain/CC0-1.0; GPL/AGPL files are excluded and must not be ingested or automatically retrieved.",
      "results": "https://github.com/cncf/foundation/issues/1117",
      "comment": "Approved with explicit exclusion of GPL/AGPL files present in the upstream repository."
    },
    {
      "id": "exc-2026-02-18-001",
      "package": "github.com/apparentlymart/go-textseg",
      "license": "Unicode-DFS-2016",
      "project": "All CNCF Projects",
      "approvedDate": "2026-02-18",
      "status": "approved",
      "scope": "No scope restrictions",
      "results": "https://github.com/cncf/foundation/issues/1242",
      "comment": "Blanket exception to allow any CNCF project to use go-textseg under Unicode-DFS-2016."
    },
    {
      "id": "exc-2026-02-18-002",
      "package": "certifi",
      "license": "MPL-2.0",
      "project": "All CNCF Projects",
      "approvedDate": "2026-02-18",
      "status": "approved",
      "scope": "Allowed only if the dependency is either (a) stored unmodified in a designated third-party folder, or (b) not stored in the CNCF project repository and instead retrieved at installation or build time from the upstream third-party repository or package repository.",
      "results": "https://github.com/cncf/foundation/issues/1208",
      "comment": "Blanket exception for certifi under MPL-2.0."
    },
    {
      "id": "exc-2026-02-18-003",
      "package": "sharp-lipvips",
      "license": "LGPL-2.1-or-later OR LGPL-3.0-only",
      "project": "All CNCF Projects",
      "approvedDate": "2026-02-18",
      "status": "approved",
      "scope": "Approved only when used as part of Next.js, in unmodified form, and only as build-time dependency, install-time dependency, or build-and-test tooling; static linking is not approved.",
      "results": "https://github.com/cncf/foundation/issues/1212",
      "comment": "Blanket exception for sharp-lipvips usage via Next.js under specified conditions."
    },
    {
      "id": "exc-2025-12-04-001",
      "package": "@auth0/quantum-product",
      "license": "Apache-2.0",
      "project": "OpenFGA",
      "approvedDate": "2025-12-04",
      "status": "denied",
      "scope": "Not Applicable (Denied)",
      "results": "https://github.com/cncf/foundation/issues/1188",
      "comment": "Denied: source code was not publicly available, making Apache-2.0 distribution compliance impossible."
    },
    {
      "id": "exc-2026-02-05-001",
      "package": "eclipse-ee4j/expressly",
      "license": "EPL-2.0 OR GPL-2.0-only WITH Classpath-exception-2.0",
      "project": "Keycloak",
      "approvedDate": "2025-01-12",
      "status": "approved",
      "scope": "Approved for dynamic linking only (static linking not permitted); furthermore, the dependency must be used in unmodified form",
      "results": "https://github.com/cncf/foundation/issues/1177",
      "comment": "Default implementation of Jakarta Expression Language 6.0, transitive dependency for Hibernate Validator"
    },
    {
      "id": "exc-2026-02-05-002",
      "package": "libpathrs",
      "license": "MPL-2.0 OR LGPL-3.0-or-later",
      "project": "All CNCF Projects",
      "approvedDate": "2025-01-12",
      "status": "approved",
      "scope": "Any CNCF project using libpathrs as a statically linked dependency MUST elect to do so under MPL-2.0 (rather than LGPL-3.0) and declare such election in its documentation. Furthermore, to minimize compliance burdens for CNCF projects and downstream users, it is strongly recommended that projects using libpathrs as a dynamically linked dependency also elect to do so under MPL-2.0 (rather than LGPL-3.0). Furthermore, libpathrs must be maintained either (a) in a distinct directory or module clearly separated from CNCF project code, or (b) retrieved at build/installation time from a third-party repository.",
      "results": "https://github.com/cncf/foundation/issues/1154",
      "comment": "Blanket exception: Projects using libpathrs statically linked MUST elect MPL-2.0 and document this. Provides secure path resolution APIs."
    },
    {
      "id": "exc-2026-02-05-003",
      "package": "go-pathrs",
      "license": "MPL-2.0",
      "project": "All CNCF Projects",
      "approvedDate": "2025-01-12",
      "status": "approved",
      "scope": "Allowed only if the dependency is either (a) stored unmodified in a designated third-party folder, or (b) not stored in the CNCF project repository and instead retrieved at installation or build time from the upstream third party repository or package repository",
      "results": "https://github.com/cncf/foundation/issues/1154",
      "comment": "Blanket exception: Go bindings for libpathrs. Provides secure path resolution APIs."
    },
    {
      "id": "exc-2025-11-21-001",
      "package": "cyphar/filepath-securejoin",
      "license": "MPL-2.0 AND BSD-3-Clause",
      "project": "All CNCF Projects",
      "approvedDate": "2025-11-21",
      "status": "approved",
      "scope": "Allowed only if the dependency is either (a) stored unmodified in a designated third-party folder, or (b) not stored in the CNCF project repository and instead retrieved at installation or build time from the upstream third party repository or package repository",
      "results": "https://github.com/cncf/foundation/issues/1154",
      "comment": "Blanket exception: Provides secure path resolution APIs on Linux. Used by Kubernetes, containerd, Podman, buildah, cri-o, nerdctl."
    },
    {
      "id": "exc-2025-11-21-002",
      "package": "Liquibase",
      "license": "FSL Functional Source License",
      "project": "Keycloak",
      "approvedDate": "2025-11-21",
      "status": "denied",
      "scope": "Not Applicable (Denied)",
      "results": "https://github.com/cncf/foundation/issues/1147",
      "comment": "Denied: FSL is not an open source license. GB does not approve exceptions for non-OSS licenses."
    },
    {
      "id": "exc-2025-10-17-001",
      "package": "paramiko",
      "license": "LGPL-2.1",
      "project": "oscal-compass",
      "approvedDate": "2025-10-17",
      "status": "approved",
      "scope": "Approved only for dynamic linking (static linking is not approved)",
      "results": "https://github.com/cncf/foundation/issues/1108",
      "comment": "Pure-Python SSHv2 protocol implementation, used for fetching files"
    },
    {
      "id": "exc-2025-10-17-002",
      "package": "certifi",
      "license": "MPL-2.0",
      "project": "oscal-compass",
      "approvedDate": "2025-10-17",
      "status": "approved",
      "scope": "Allowed only if the dependency is either (a) stored unmodified in a designated third-party folder, or (b) not stored in the CNCF project repository and instead retrieved at installation or build time from the upstream third party repository or package repository",
      "results": "https://github.com/cncf/foundation/issues/1091",
      "comment": "Dependency for requests library"
    },
    {
      "id": "exc-2025-10-17-003",
      "package": "pathspec",
      "license": "MPL-2.0",
      "project": "oscal-compass",
      "approvedDate": "2025-10-17",
      "status": "approved",
      "scope": "Allowed only if the dependency is either (a) stored unmodified in a designated third-party folder, or (b) not stored in the CNCF project repository and instead retrieved at installation or build time from the upstream third party repository or package repository",
      "results": "https://github.com/cncf/foundation/issues/1090",